{
  "outcome": "answered",
  "stop_reason": "nothing-relevant-left",
  "pages_read": 2,
  "relevant_memory": [
    {
      "summary": "Visible UI and its visual verification share one owner.",
      "path": "01 Decisions/UI ownership.md",
      "hash": "a3f1c9d2e47b5860b1d4c7e9f20a38566d1b9e4c7a05f2d83b6c1e94a07d5f32"
    }
  ],
  "constraints": [
    "Do not route visual correctness checks to backend agents."
  ],
  "watchouts": [],
  "note_paths": [
    "01 Decisions/UI ownership.md"
  ],
  "direct_read_paths": [
    "01 Decisions/UI ownership.md"
  ]
}
